;meta[language=fr]
; id | key(hex) | key(str) | text
2119878000|85E8FBD1|skill_desc_wolf_set_ability1|Any attacks that inflict damage increase the duration of White Wolf's Wrath by $S$ seconds.
2119878001|85E8FBD2|skill_desc_wolf_set_ability2|Reduces the cooldown of White Wolf's Wrath by $S$ seconds.
2119878002|EFA7F95B|item_name_wolfschool_crossbow|Wolf School Crossbow
2119878003|EAA0CAA1|item_name_super_red_mutagen|Supreme Red Mutagen
2119878004|900F5213|item_name_super_green_mutagen|Supreme Green Mutagen
2119878005|6055C982|item_name_super_blue_mutagen|Supreme Blue Mutagen
2119878006|13269EB1|item_name_aerondight_ep2|Aerondight, The Sword of Destiny
2119878007|E2E48F93|skill_name_sword_s19|White Wolf's Wrath
2119878008|CEA74419|skill_desc_sword_s19|Casting a sign while adrenaline is full will cause Geralt to temporarily trigger and awaken his untapped potential. In this state he is invulnerble, his vitality regenerates at an accelerated pace and all of his abilities deal double damage for 20 seconds. Cannot be used again afterwords for 50 seconds.
2119878009|483C9092|attribute_name_aerondight|Each blow generates charges which increase sword damage by $S$%. Charges are lost over time or when receiving damage. A fully-charged sword always deals critical hit damage and ignores defenses. Is effective against both humans and monsters.
2119878010|15DDA91B|skill_desc_alchemy_s17|If Toxicity is above 0, each opponent killed increases critical hit chance, damage, attack power and spell power by $I$% for the duration of that fight.
2119878011|CEA74416|skill_desc_sword_s16|Adrenaline Point loss upon taking damage is lowered by $I$% and stagger duration is divided by $I$. Passive Bonus:Increases attack power by $I$%.
2119878012|8D17AAA2|skill_desc_alchemy_s7|When Adrenaline Points are at their maximum critical hit damage against the targeted enemy type is increased by $I$%. Passive Bonus: Increases monster damage resistance by $I$%.
2119878013|15DDA917|skill_desc_alchemy_s13|When consumed, mutagen decoction increases maximum Vitality by $I$ for decoction's effective duration. Passive Bonus: Increases Slashing, Piercing and Bludgeoning resistance by $I$%.
2119878014|15DDA918|skill_desc_alchemy_s14|Extends effective duration of all mutagen decoctions by $I$%. Passive Bonus: Increases poison damage resistance by $I$%.
2119878015|1F70C022|skill_desc_sword_s3|Each Adrenaline Point increases the chance of causing a brutal strike by $I$%. Brutal strikes increase overall critical hit damage bonuses by 25%. Passive Bonus: Increases critical hit damage by $I$% and increases damage resistance by $I$%.
2119878016|163A8E76|skill_desc_magic_s7|Increases Igni Sign intensity by $I$%. Passive Bonus: Increases burning resistance by $I$%.
2119878017|B1173FC6|skill_desc_magic_s16|Increases Yrden Sign intensity by $I$%. Passive Bonus: Increases elemental damage resistance by $I$%.
2119878018|FF5FE15|skill_name_alchemy_s17|Butcher of Blaviken
2119878019|2A74C610|skill_desc_prev_alchemy_s18|Every known level 1 alchemy formula increases maximum Toxicity by 1. Reduces mutagen decoction toxicity by 10.
2119878020|15DDA91C|skill_desc_alchemy_s18|Every known level 1 alchemy formula increases maximum Toxicity by 1. Reduces mutagen decoction toxicity by 10.
2119878021|1517DDCF|skill_desc_alchemy_s18_2|Every known level 1 or 2 alchemy formula increases maximum Toxicity by 1. Reduces mutagen decoction toxicity by 20.
2119878022|1517DDD0|skill_desc_alchemy_s18_3|Every known level 1, 2 or 3 alchemy formula increases maximum Toxicity by 1. Reduces mutagen decoction toxicity by 30.
2119878023|1F70C028|skill_desc_sword_s9|Damage from hits received while dodging are reduced by $I$%. Passive bonus:Increases bleeding resistance by $I$%.
2119878024|CEA7442F|skill_desc_sword_s20|Instantly gain one Adrenaline Point when entering combat. The Adrenaline Points generated by sword blows are increased by $I$%. Each adrenaline point now also adds $I$% critical damage bonus. Passive Bonus: All sword attacks deal $I$ bleeding damage.
2119878025|BCFF1D6B|skill_name_sword_s6|Violence
2119878026|1F70C025|skill_desc_sword_s6|Increases attack power by $I$% and critical hit damage by $I$% for all sword attacks. Passive bonus: adds $I$% damage reduction against all attacks.
2119878027|1F70C027|skill_desc_sword_s8|Increases strong critical hit chance by $I$% and strong attack critical hit damage by $I$%. Strong attacks now crush enemy armor and reduce their damage resistance by $I$%. 
2119878028|163A8E78|skill_desc_magic_s9|Increases the chance to apply Burning by $I$%. Passive Bonus:Adds $I$ fire damage to all attacks (increases with character level).
2119878029|163A8E75|skill_desc_magic_s6|Increases the damage dealt by Aard to $I$. Passive Bonus: Adds $I$ force damage to all attacks (increases with character level).
2119878030|8D17AA9C|skill_desc_alchemy_s1|Increases potion overdose threshold by $I$%. Passive Bonus: Reduces potiion toxicity by $I$%.
2119878031|C5548B3B|skill_name_magic_s11|Control Over The Power
2119878032|B1173FC1|skill_desc_magic_s11|Increases damage resistance by $I$% to all attacks. Also increases sign intensity by $I$%. Passive Bonus: Adds $I$ shock damage to all attacks.
2119878033|B6F909B5|skill_desc_prev_magic_s11|Increases damage resistance, spell power and provides a passive shock damage bonus to all attacks.
2119878034|B1173FC0|skill_desc_magic_s10|Increases Sign duration by $I$ seconds. Number of alternate mode charges: $I$. Number of Standard mode traps: $I$. Enemies under the influence of Yrden lose $I$ point(s) of Vitality or Essence per second. Receives additional damage from $I$ of spell power.
2119878035|C5548B3A|skill_name_magic_s10|The 5th Element
2119878036|1F70C023|skill_desc_sword_s4|Strong attack damage increased by $I$%. Increases bludgeoning damage resistance by $I$%. Passive Bonus: Increases vitality by $I$%.
2119878037|B1173FC4|skill_desc_magic_s14|Provides $I$% damage reduction against all damage types, increases spell power by $I$% and attack power by $I$%. Passive bonuses: Passive bonus: Increases critical hit damage by $I$% and reduces enemy resistances by $I$%. 
2119878038|C5548B3E|skill_name_magic_s14|Raw Power
2119878039|B6F909B7|skill_desc_prev_magic_s13|Quen shield pushes opponents back when it breaks. Reflects $I$% absorbed damage back to the attacker.
2119878040|B1173FC3|skill_desc_magic_s13|Quen shield pushes opponents back when it breaks. Reflects $I$% absorbed damage back to the attacker.
2119878041|C84666B6|skill_desc_magic_s13_2|Quen shield pushes opponents back and deals damage when it breaks. Reflects $I$% absorbed damage back to the attacker.
2119878042|C84666B7|skill_desc_magic_s13_3|Quen shield pushes opponents back and deals damage when it breaks with a chance for knock-down. Reflects $I$% absorbed damage back to the attacker.
2119878043|CEA74415|skill_desc_sword_s15|Each bolt that hits its target adds $F$ Adrenaline Points. Passive bonus: Increases critical hit damage by $I$%.
2119878044|754D1899|skill_desc_perk_19|Battle Trance now increases critical hit chance by $I$%, an additional $I$% critical hit damage and $I$% attack power per Adrenaline Point
2119878045|C84675BB|skill_desc_magic_s17_3|Target does not move towards Geralt while he is casting Axii. Increases the effectiveness of Axii in dialogues. Reduces Axii casting time. Axii can now be used on two opponents at the same time.
2119878046|B1173FC9|skill_desc_magic_s19|Increases total sign intensity by $I$%, attack power by $I$%. Axii now causes enemies to bleed, dealing $I$ damage per second, scaling with sign intensity.
2119878047|B6F909BD|skill_desc_prev_magic_s19|Increases total sign intensity by $I$%, attack power by $I$%. Axii now causes enemies to bleed, dealing $I$ damage per second, scaling with sign intensity.
2119878048|C8467D3C|skill_desc_magic_s19_2|Increases total sign intensity by $I$%, attack power by $I$%. Axii now causes enemies to bleed, dealing $I$ damage per second, scaling with sign intensity.
2119878049|C8467D3D|skill_desc_magic_s19_3|Increases total sign intensity by $I$%, attack power by $I$%. Axii now causes enemies to bleed, dealing $I$ damage per second, scaling with sign intensity.
2119878050|6C0D2B4A|item_name_aerondight_2_schematic|Aerondight Upgrade Schematic
2119878051|F1DE0B|item_name_aerondight_3_schematic|Aerondight Enhancement Schematic
2119878052|BD2F328E|item_name_aerondight_final_schematic|Aerondight Final Form Schematic
2119878053|698EA9D7|instant_kill_chance|Brutal Strike Chance
2119878054|65009139|item_name_viper_armor_final|White Wolf's Armor
2119878055|B1C041CE|item_name_viper_gloves_final|White Wolf's Gauntlets
2119878056|B6171216|item_name_viper_pants_final|White Wolf's Pants
2119878057|81DDEA3B|item_name_viper_boots_final|White Wolf's Boots
2119878058|15DDA933|skill_desc_alchemy_s20|Increases maximum Vitality by $I$% when Toxicity exceeds the safe threshold. Passive Bonus: Increases damage reduction by $I$%.
2119878059|37010020|item_name_infatigable_mutagen|Infatigable Mutagen
2119878060|95A84526|item_desc_infatigable_mutagen|Increases attack power by 20%. Actions such as sprinting and jumping do not consume stamina outside of combat.
2119878061|FC921528|item_desc_mutagen_24|Gain 50% to Attack and Sign Power, +5/s to Stamina regeneration and +25% to Adrenaline gain while health is at 20% or lower. Resets when health is regained and at the end of combat. 10s cooldown.
2119878062|FC92152B|item_desc_mutagen_27|On casting a sign in combat, increases stamina regeneration by 1% and sign power by 1%, up to a maximum of 50%. The effect lasts for the duration of the decoction or until meditating.
2119878063|9A007CED|effect_whiteWolf|White Wolf's Wrath
2119878064|B504BFE6|effect_whiteWolf_debuff|White Wolf's Wrath Is On Cooldown
2119878065|E88691FE|item_name_solide_mutagen|Solide Mutagen
2119878066|12FDC138|item_desc_solide_mutagen|Increases vitality by 500. Adds 3% damage reduction against all attacks
2119878067|A6383EDC|item_name_hexer_mutagen|Hexer Mutagen
2119878068|D0E14062|item_desc_hexer_mutagen|Increases Sign Intensity By 20%. Casting the Axiii sign will inflict 400 damage on an enemy and restore a portion of Geralt's life. Damage and life scales with sign intensity.
2119878069|CEA74413|skill_desc_sword_s13|Time is slowed by an additional $I$% while aiming the crossbow. Passive Bonus:Damage is reduced by $I$%.
2119878070|CEA74418|skill_desc_sword_s18|When Vitality reaches 0, it will be restored with a bonus of 25%. Requires at least 1 Adrenaline Point, which will be consumed. Passive Bonus: Adds $I$% damage reduction.
2119878071|C1E6A9CB|skill_desc_sword_s18_2|When Vitality reaches 0, Adrenaline Points will immediately be consumed to restore it, with a bonus of $I$%. The amount restored is based on the number of Adrenaline Points used. If no Adrenaline Points are available, a small portion of Vitality will be restored. Passive Bonus: Adds $I$% damage reduction.
2119878072|C1E6A9CC|skill_desc_sword_s18_3|When Vitality reaches 0, Adrenaline Points will immediately be consumed to restore it, with a bonus of $I$%. The amount restored is based on the number of Adrenaline Points used. If no Adrenaline Points are available, a small portion of Vitality will be restored. If Geralt has White Wolf's Wrath as a skill, it will be activated instead (regardless of whether or not it is on cooldown). Passive Bonus: Adds $I$% damage reduction.
2119878073|C1E6AD8C|skill_desc_sword_s19_2|Casting a sign while adrenaline is full will cause Geralt to temporarily trigger and awaken his untapped potential. In this state he is invulnerble, his vitality regenerates at an accelerated pace and all of his abilities deal triple damage for 30 seconds. Cannot be used again afterwords for 50 seconds.
2119878074|C1E6AD8D|skill_desc_sword_s19_3|Casting a sign while adrenaline is full will cause Geralt to temporarily trigger and awaken his untapped potential. In this state he is invulnerble, his vitality regenerates at an accelerated pace and all of his abilities deal quadruple damage for 40 seconds. This effect will now also be triggered in place of any effects granted by abilities that are used when Geralt's life reaches zero. Cannot be used again afterwords for 50 seconds.
2119878075|3682EE98|instant_kill_chance_mult|Brutal Strike Chance


